record_id	pmid	doi	year	title_short	country_or_region	income_level	target_population	target_population_notes	setting	delivery_model	return_channel	followup_support	self_sampling_confirmed	assay_type	triage_pathway	design	n_invited	n_participated	uptake_pct	followup_closure_reported	followup_reporting_level	followup_completion_pct	followup_notes	equity_stratified_results_reported	acceptability_reported	cost_reported	key_barriers_facilitators	limitations	implementation_core_status	implementation_core_reason	implementation_core_evidence
PMID_30179994	30179994	10.1097/lgt.0000000000000430	2018	Preference for Human Papillomavirus Self-Collection and Papanicolaou: Survey of Underscreened Women in North Carolina.	UNK	UNK	underscreened_general		primary_care	clinic_pickup_return_clinic	in_person	unk	Y	UNK	cytology	observational				Y	referral_only			N	Y	N		Auto-charted from abstract-level info; verify/complete when OA full text is available.	CORE	extractable_implementation_or_cascade_result	
PMID_30197540	30197540	10.2147/clep.s164826	2018	HPV self-sampling in cervical cancer screening: the effect of different invitation strategies in various socioeconomic g	UNK	UNK	migrant_minority		home_mail	mail_to_home_return_mail	mail	reminders	Y	UNK	cytology	individual_RCT	791.0		8.1	N	none			N	N	N		Auto-charted from abstract-level info; verify/complete when OA full text is available.	CORE	extractable_implementation_or_cascade_result	
PMID_30216191	30216191	10.2478/raon-2018-0036	2018	Randomised trial of HPV self-sampling among non-attenders in the Slovenian cervical screening programme ZORA: comparing 	Slovenia	HIC	nonattenders		home_mail	home_mail	unk	unk	Y	DNA	direct_colposcopy	individual_RCT			7.7	Y	referral_only			N	N	N		Field reconciled during final eligibility review.	CORE	extractable_implementation_or_cascade_result	
PMID_30399091	30399091	10.1097/aog.0000000000002964	2018	Home Self-Collection by Mail to Test for Human Papillomavirus and Sexually Transmitted Infections.	United States	HIC	other		primary_care	clinic_pickup_return_clinic	in_person	unk	Y	DNA	cytology	other				N	none			N	Y	N		Auto-charted from abstract-level info; verify/complete when OA full text is available.	CORE	Validation/Acceptability study with 193 participants in NC.	Overall, 193 women had conclusive high-risk HPV results for all three samples.
PMID_30518468	30518468		2018	[HPV self-sampling for cervical cancer screening in Denmark].	UNK	UNK	underscreened_general		other	unk	unk	reminders	Y	UNK	unk	other				Y	referral_only			N	N	N		Auto-charted from abstract-level info; verify/complete when OA full text is available.	CORE	extractable_implementation_or_cascade_result	
PMID_30627330	30627330	10.4314/mmj.v30i2.2	2018	Feasibility, validity and acceptability of self-collected samples for human papillomavirus (HPV) testing in rural Malawi	UNK	UNK	other		primary_care	clinic_pickup_return_clinic	in_person	unk	Y	UNK	cytology	observational				N	none			N	Y	N		Auto-charted from abstract-level info; verify/complete when OA full text is available.	CORE	Feasibility study with 199 enrolled women in Malawi.	Among the 199 enrolled women, 22% had any high risk-HPV.
PMID_26944955	26944955	10.1136/jfprhc-2015-101305	2017	Factors influencing Malawian women's willingness to self-collect samples for human papillomavirus testing.	UNK	UNK	rural_low_access	rural under-screened	community_outreach	outreach_event_distribution	mixed	unk	Y	UNK	cytology	other				N	none			N	Y	N		Auto-charted from abstract-level info; verify/complete when OA full text is available.	CORE	Longitudinal study with actual self-collection outcomes (n=824).	...enrollment from the catchment area ... willingness to self-collect was captured.
PMID_27235844	27235844	10.1177/0969141316639346	2017	Offering self-sampling to cervical screening non-attenders in primary care.	UNK	UNK	nonattenders		home_mail	unk	unk	unk	Y	DNA	cytology	program_evaluation			14.0	Y	completion_reported	85.0	HPV-positive participants: 33/39 attended follow-up.	N	Y	N		Auto-charted from abstract-level info; verify/complete when OA full text is available.	CORE	extractable_implementation_or_cascade_result	
PMID_27774794	27774794	10.1080/13557858.2016.1246423	2017	Intravaginal practices are associated with greater odds of high-risk HPV infection in Haitian women.	UNK	UNK	other		community_outreach	chw_door_to_door	mixed	unk	Y	DNA	cytology	observational				N	none			Y	N	N		Auto-charted from abstract-level info; verify/complete when OA full text is available.	CORE	Community participatory research with 416 women.	CHWs recruited 416 women for cervical self-sampling ... 11% ... tested positive.
PMID_28050338	28050338	10.1016/j.pmedr.2016.12.017	2017	Efficacy of self-sampling in promoting participation to cervical cancer screening also in subsequent round.	UNK	UNK	underscreened_general		home_mail	unk	unk	reminders	Y	UNK	unk	individual_RCT	2995.0	47.0	2.0	N	none			N	N	N		Auto-charted from abstract-level info; verify/complete when OA full text is available.	CORE	extractable_implementation_or_cascade_result	
PMID_28086933	28086933	10.1186/s12905-016-0360-0	2017	Self-collection based HPV testing for cervical cancer screening among women living with HIV in Uganda: a descriptive ana	UNK	UNK	other		primary_care	clinic_pickup_return_clinic	in_person	unk	Y	UNK	unk	observational				Y	referral_only			N	Y	N		Auto-charted from abstract-level info; verify/complete when OA full text is available.	CORE	extractable_implementation_or_cascade_result	
PMID_28184239	28184239	10.1186/s13027-017-0123-z	2017	Randomized trial evaluating self-sampling for HPV DNA based tests for cervical cancer screening in Nigeria.	Nigeria	LMIC	rural_low_access	Community-based trial in Sub-Saharan Africa / hard-to-reach setting with low screening uptake context.	community_outreach	outreach_event_distribution	mixed	unk	Y	DNA	unk	individual_RCT	400	185	93.0	N	none		Reported screening uptake and sample adequacy; no post-positive follow-up completion reported in abstract.	N	N	N		Added after audit: community-based Nigerian RCT in low-screening/hard-to-reach SSA context.	CORE	Community-based randomized trial in Nigeria with observed self-sampling uptake and sample adequacy outcomes.	Most participants in the self-collection arm (93%, 185/200) submitted samples; community-based trial in Abuja, Nigeria.
PMID_28193227	28193227	10.1186/s13012-017-0548-1	2017	Evaluation of scaling-up of HPV self-collection offered by community health workers at home visits to increase screening	UNK	UNK	underscreened_general		community_outreach	chw_door_to_door	mixed	unk	Y	UNK	cytology	observational		315.0		Y	completion_reported	77.5	HPV-positive women: 320/414 had follow-up procedures.	N	N	N		Auto-charted from abstract-level info; verify/complete when OA full text is available.	CORE	extractable_implementation_or_cascade_result	
PMID_28195317	28195317	10.1002/ijc.30647	2017	Human papillomavirus self-sampling for screening nonattenders: Opt-in pilot implementation with electronic communication	UNK	UNK	nonattenders		home_mail	unk	unk	reminders	Y	UNK	unk	program_evaluation			31.7	N	none		Reported request/return and physician screening after invitation; no HPV-positive follow-up completion.	N	N	N		Auto-charted from abstract-level info; verify/complete when OA full text is available.	CORE	extractable_implementation_or_cascade_result	
PMID_28223432	28223432	10.1158/1055-9965.epi-16-0960	2017	Performance and Diagnostic Accuracy of a Urine-Based Human Papillomavirus Assay in a Referral Population.	UNK	UNK	other		primary_care	clinic_pickup_return_clinic	in_person	unk	Y	UNK	direct_colposcopy	other				Y	referral_only			N	N	N		Auto-charted from abstract-level info; verify/complete when OA full text is available.	CORE	extractable_implementation_or_cascade_result	
PMID_28304400	28304400	10.1038/modpathol.2017.16	2017	Evaluation of p16/Ki-67 dual-stained cytology as triage test for high-risk human papillomavirus-positive women.	UNK	UNK	nonattenders		primary_care	clinic_pickup_return_clinic	in_person	unk	Y	DNA	cytology	other				Y	referral_only			N	N	N		Auto-charted from abstract-level info; verify/complete when OA full text is available.	CORE	extractable_implementation_or_cascade_result	
PMID_28427086	28427086	10.1038/bjc.2017.111	2017	Self-sampling to improve cervical cancer screening coverage in Switzerland: a randomised controlled trial.	UNK	UNK	other		home_mail	mail_to_home_return_mail	mail	unk	Y	UNK	direct_colposcopy	individual_RCT	331.0			Y	referral_only			N	N	N		Auto-charted from abstract-level info; verify/complete when OA full text is available.	CORE	extractable_implementation_or_cascade_result	
PMID_28579497	28579497	10.1016/j.ypmed.2017.05.021	2017	High-risk human papillomavirus detection in self-sampling compared to physician-taken smear in a responder population of	Netherlands	HIC	nonattenders		other	unk	unk	unk	Y	DNA	cytology	program_evaluation	2015.0			Y	referral_only			N	Y	N		Auto-charted from abstract-level info; verify/complete when OA full text is available.	CORE	extractable_implementation_or_cascade_result	
PMID_28589548	28589548	10.1002/ijgo.12204	2017	A pilot study of community-based self-sampling for HPV testing among non-attenders of cervical cancer screening programs	UNK	UNK	nonattenders		home_mail	mail_to_home_return_mail	mail	unk	Y	DNA	unk	observational				N	none			N	Y	N		Auto-charted from abstract-level info; verify/complete when OA full text is available.	CORE	Pilot study with 60 rural women in El Salvador.	Self-sampling was accepted by 41 (68%) participants. ... high-risk HPV ... was 17%.
PMID_28631511	28631511	10.1080/01443615.2017.1323197	2017	Self-collected cervicovaginal sampling for site-of-care primary HPV-based cervical cancer screening: a pilot study in a 	UNK	UNK	other		primary_care	clinic_pickup_return_clinic	in_person	unk	Y	DNA	direct_colposcopy	observational		100.0	0.0	Y	referral_only		HPV-positive women were referred to colposcopy; attendance/completion not reported.	N	N	N		Auto-charted from abstract-level info; verify/complete when OA full text is available.	CORE	extractable_implementation_or_cascade_result	
PMID_28724543	28724543	10.1136/bmjopen-2017-016309	2017	Cervical cancer screening in rural Bhutan with the careHPV test on self-collected samples: an ongoing cross-sectional, p	UNK	UNK	never_screened		community_outreach	outreach_event_distribution	mixed	unk	Y	UNK	cytology	observational	3648.0	71.0	1.0	Y	referral_only			N	N	N		Auto-charted from abstract-level info; verify/complete when OA full text is available.	CORE	extractable_implementation_or_cascade_result	
PMID_28724554	28724554	10.1128/jcm.00550-17	2017	Prevalence of Human Papillomavirus in Self-Taken Samples from Screening Nonattenders.	UNK	UNK	nonattenders		primary_care	clinic_pickup_return_clinic	in_person	unk	Y	DNA	cytology	other		632.0		Y	referral_only			N	N	N		Auto-charted from abstract-level info; verify/complete when OA full text is available.	CORE	extractable_implementation_or_cascade_result	
PMID_28864487	28864487	10.1136/bmjopen-2017-017384	2017	Self-administered versus provider-directed sampling in the Anishinaabek Cervical Cancer Screening Study (ACCSS): a quali	Canada	HIC	underscreened_general		community_outreach	outreach_event_distribution	mixed	unk	Y	UNK	cytology	cluster_RCT				Y	referral_only			N	Y	N		Auto-charted from abstract-level info; verify/complete when OA full text is available.	CORE	extractable_implementation_or_cascade_result	
PMID_28879068	28879068	10.1016/j.pmedr.2016.12.014	2017	Self-collected vaginal swabs for HPV screening: An exploratory study of rural Black Mississippi women.	UNK	UNK	other		community_outreach	outreach_event_distribution	mixed	unk	Y	DNA	cytology	observational				Y	referral_only			N	Y	N		Auto-charted from abstract-level info; verify/complete when OA full text is available.	CORE	extractable_implementation_or_cascade_result	
PMID_29094082	29094082	10.1200/jgo.2016.005629	2017	Acceptability of Human Papillomavirus Self-Sampling for Cervical Cancer Screening in an Indigenous Community in Guatemal	UNK	UNK	other	Indigenous/minority focus	community_outreach	outreach_event_distribution	mixed	unk	Y	DNA	cytology	individual_RCT				Y	referral_only			N	Y	N		Auto-charted from abstract-level info; verify/complete when OA full text is available.	CORE	extractable_implementation_or_cascade_result	
PMID_29121873	29121873	10.1186/s12885-017-3723-5	2017	Barriers to HPV self-sampling and cytology among low-income indigenous women in rural areas of a middle-income setting: 	UNK	UNK	other	Indigenous/minority focus	home_mail	unk	unk	unk	Y	UNK	cytology	observational				N	none			N	N	N		Auto-charted from abstract-level info; verify/complete when OA full text is available.	CORE	Qualitative study conducted after actual self-test provision.	...after they were provided with free, self-sampled HPV tests.
PMID_29208043	29208043	10.1186/s13104-017-3045-3	2017	Self-sampling for human papillomavirus testing among rural young women of KwaZulu-Natal, South Africa.	UNK	UNK	other		other	unk	unk	unk	Y	DNA	cytology	observational				Y	referral_only			N	Y	N		Auto-charted from abstract-level info; verify/complete when OA full text is available.	CORE	extractable_implementation_or_cascade_result	
PMID_29273032	29273032	10.1186/s12905-017-0490-z	2017	Self-sampling for human papillomavirus DNA detection: a preliminary study of compliance and feasibility in BOLIVIA.	UNK	UNK	other		primary_care	clinic_pickup_return_clinic	in_person	unk	Y	DNA	cytology	other				Y	referral_only			N	N	N		Auto-charted from abstract-level info; verify/complete when OA full text is available.	CORE	extractable_implementation_or_cascade_result	
PMID_26248549	26248549	10.1136/jech-2015-205851	2016	Age-specific performance of careHPV versus Papanicolaou and visual inspection of cervix with acetic acid testing in a pr	UNK	UNK	other		other	unk	unk	unk	Y	DNA	cytology	other	7761.0			N	none			N	N	N		Auto-charted from abstract-level info; verify/complete when OA full text is available.	CORE	extractable_implementation_or_cascade_result	
PMID_26421807	26421807	10.1002/ijc.29877	2016	Effectiveness of novel, lower cost molecular human papillomavirus-based tests for cervical cancer screening in rural chi	UNK	UNK	other		primary_care	clinic_pickup_return_clinic	in_person	unk	Y	DNA	direct_colposcopy	individual_RCT				Y	referral_only		Diagnostic performance study with baseline and one-year procedures; no HPV-positive follow-up completion denominator reported.	N	N	Y		Auto-charted from abstract-level info; verify/complete when OA full text is available.	CORE	extractable_implementation_or_cascade_result	
PMID_26598955	26598955	10.1089/jwh.2015.5348	2016	Randomized Intervention of Self-Collected Sampling for Human Papillomavirus Testing in Under-Screened Rural Women: Uptak	Canada	HIC	rural_low_access	rural under-screened	home_mail	unk	unk	reminders	Y	UNK	cytology	individual_RCT		37.0	1.0	N	none			N	Y	N		Auto-charted from abstract-level info; verify/complete when OA full text is available.	CORE	extractable_implementation_or_cascade_result	
PMID_26723863	26723863	10.1016/j.jfma.2015.10.014	2016	Self-sampling HPV test in women not undergoing Pap smear for more than 5 years and factors associated with under-screeni	UNK	UNK	underscreened_general		home_mail	mail_to_home_return_mail	mail	reminders	Y	UNK	direct_colposcopy	individual_RCT	2010.0	2012.0	5.0	Y	referral_only			N	Y	Y		Auto-charted from abstract-level info; verify/complete when OA full text is available.	CORE	extractable_implementation_or_cascade_result	
PMID_26850941	26850941	10.1002/ijc.30031	2016	Home-based HPV self-sampling improves participation by never-screened and under-screened women: Results from a large ran	Australia	HIC	never_screened		home_mail	mail_to_home_return_mail	mail	reminders	Y	DNA	direct_colposcopy	individual_RCT	20.0	1649.0	2.7	Y	completion_reported	62.2	HPV16/18-positive participants: 28/45 had colposcopy; other hrHPV pathway reported 82.1% Pap testing.	N	N	N		Auto-charted from abstract-level info; verify/complete when OA full text is available.	CORE	extractable_implementation_or_cascade_result	
PMID_26890012	26890012	10.1089/jwh.2015.5469	2016	Acceptability and Feasibility of Human Papilloma Virus Self-Sampling for Cervical Cancer Screening.	UNK	UNK	other		primary_care	clinic_pickup_return_clinic	in_person	unk	Y	UNK	cytology	other				Y	referral_only			N	Y	N		Auto-charted from abstract-level info; verify/complete when OA full text is available.	CORE	extractable_implementation_or_cascade_result	
PMID_26890683	26890683	10.1097/lgt.0000000000000188	2016	Introducing a High-Risk HPV DNA Test Into a Public Sector Screening Program in El Salvador.	UNK	UNK	underscreened_general		community_outreach	outreach_event_distribution	mixed	unk	Y	DNA	direct_colposcopy	other				Y	referral_only			N	N	N		Auto-charted from abstract-level info; verify/complete when OA full text is available.	CORE	extractable_implementation_or_cascade_result	
PMID_26919866	26919866	10.1177/0969141315625702	2016	HPV self-sampling in Japanese women: A feasibility study in a population with limited experience of tampon use.	UNK	UNK	nonattenders		other	unk	unk	unk	Y	UNK	cytology	other				N	none			N	Y	N		Auto-charted from abstract-level info; verify/complete when OA full text is available.	CORE	Feasibility pilot within workplace screening with comparison data.	In total, 203 women ... performed unsupervised HPV self-sampling.
PMID_26979237	26979237	10.1186/s12885-016-2246-9	2016	Self-sampling in cervical cancer screening: comparison of a brush-based and a lavage-based cervicovaginal self-sampling 	UNK	UNK	other		other	unk	unk	reminders	Y	UNK	unk	individual_RCT	2013.0	6045.0	1.7	N	none			N	Y	N		Auto-charted from abstract-level info; verify/complete when OA full text is available.	CORE	extractable_implementation_or_cascade_result	
PMID_26991464	26991464	10.1002/ijc.30090	2016	The clinical value of HPV genotyping in triage of women with high-risk-HPV-positive self-samples.	UNK	UNK	other		primary_care	clinic_pickup_return_clinic	in_person	unk	Y	DNA	cytology	individual_RCT	520.0			Y	referral_only			N	Y	N		Auto-charted from abstract-level info; verify/complete when OA full text is available.	CORE	extractable_implementation_or_cascade_result	
PMID_27015435	27015435	10.1016/j.jcv.2016.02.027	2016	Genotyping and follow-up of HR-HPV types detected by self-sampling in women from low socioeconomic groups not participat	France	HIC	other		other	unk	unk	unk	Y	UNK	cytology	other		4245.0	8.7	Y	referral_only			N	N	N		Auto-charted from abstract-level info; verify/complete when OA full text is available.	CORE	extractable_implementation_or_cascade_result	
PMID_27073929	27073929	10.1371/journal.pone.0151978	2016	Self-Sampling for Human Papillomavirus Testing among Non-Attenders Increases Attendance to the Norwegian Cervical Cancer	UNK	UNK	nonattenders		home_mail	unk	unk	reminders	Y	DNA	cytology	individual_RCT		33.0	3.4	Y	completion_reported	94.1	hrHPV-positive self-sampling subgroup: 32/34 attended follow-up.	N	N	N		Auto-charted from abstract-level info; verify/complete when OA full text is available.	CORE	extractable_implementation_or_cascade_result	
PMID_27076663	27076663	10.1128/jcm.00529-16	2016	Field Evaluation of Xpert HPV Point-of-Care Test for Detection of Human Papillomavirus Infection by Use of Self-Collecte	UNK	UNK	other		primary_care	clinic_pickup_return_clinic	in_person	unk	Y	DNA	cytology	program_evaluation				Y	referral_only		Same-day treatment was offered to eligible positives; attendance/completion denominator not reported in the abstract.	N	N	N		Auto-charted from abstract-level info; verify/complete when OA full text is available.	CORE	Clinical pilot with point-of-care results and same-day treatment.	...1,005 women were enrolled ... positive were offered same-day cryotherapy.
PMID_27161432	27161432	10.1016/j.canep.2016.04.013	2016	Human papillomavirus prevalence and type-specific distribution of high- and low-risk genotypes among Malagasy women livi	UNK	UNK	other		other	unk	unk	unk	Y	DNA	cytology	other				N	none			N	N	N		Auto-charted from abstract-level info; verify/complete when OA full text is available.	CORE	Prevalence study with 1081 participants and follow-up clinical exams.	SPECIMENS: ... Specimens were self-collected ... HPV-positive women underwent pelvic examination.
PMID_27188273	27188273	10.1136/sextrans-2015-052397	2016	Vaginal high-risk human papillomavirus infection in a cross-sectional study among women of six different ethnicities in 	Netherlands	HIC	migrant_minority		other	unk	unk	unk	Y	DNA	cytology	observational				N	none			Y	N	N		Auto-charted from abstract-level info; verify/complete when OA full text is available.	CORE	Cross-sectional study (HELIUS) with actual self-sampling results (N=592).	Self-collected vaginal swabs were tested for HPV DNA and genotyped...
PMID_27444141	27444141	10.1111/phn.12285	2016	Provider-Identified Barriers to Cervical Cancer Screening and Perceptions Toward Self-Collection of Human Papillomavirus	UNK	UNK	other		community_outreach	outreach_event_distribution	mixed	unk	Y	UNK	unk	observational			27.0	N	none			N	Y	Y		Auto-charted from abstract-level info; verify/complete when OA full text is available.	CORE	extractable_implementation_or_cascade_result	
PMID_27446557	27446557	10.3892/mco.2016.926	2016	Control of cervical cancer in Peru: Current barriers and challenges for the future.	UNK	UNK	other		other	unk	unk	reminders	Y	DNA	cytology	other				Y	referral_only			N	N	Y		Auto-charted from abstract-level info; verify/complete when OA full text is available.	CORE	extractable_implementation_or_cascade_result	
PMID_27459506	27459506	10.1080/14737159.2016.1217157	2016	Management of high-risk HPV-positive women for detection of cervical (pre)cancer.	UNK	UNK	other		primary_care	clinic_pickup_return_clinic	in_person	unk	Y	DNA	direct_colposcopy	other				Y	referral_only			N	N	N		Auto-charted from abstract-level info; verify/complete when OA full text is available.	CORE	extractable_implementation_or_cascade_result	
PMID_27538390	27538390	10.1186/s12889-016-3474-2	2016	HPV testing: a mixed-method approach to understand why women prefer self-collection in a middle-income country.	UNK	UNK	nonattenders		primary_care	clinic_pickup_return_clinic	in_person	unk	Y	UNK	cytology	observational				Y	referral_only			N	Y	Y		Auto-charted from abstract-level info; verify/complete when OA full text is available.	CORE	extractable_implementation_or_cascade_result	
PMID_27632816	27632816	10.3310/hta20680	2016	A cluster randomised trial of strategies to increase cervical screening uptake at first invitation (STRATEGIC).	UNK	UNK	nonattenders		primary_care	clinic_pickup_return_clinic	in_person	navigation	Y	UNK	cytology	cluster_RCT		10126.0	1.3	N	none			N	Y	Y		Auto-charted from abstract-level info; verify/complete when OA full text is available.	CORE	extractable_implementation_or_cascade_result	
PMID_27855089	27855089	10.1136/bmjopen-2016-011754	2016	Community-randomised controlled trial embedded in the Anishinaabek Cervical Cancer Screening Study: human papillomavirus	Canada	HIC	underscreened_general		community_outreach	outreach_event_distribution	mixed	unk	Y	UNK	cytology	cluster_RCT			5.0	N	none			N	Y	N		Auto-charted from abstract-level info; verify/complete when OA full text is available.	CORE	extractable_implementation_or_cascade_result	
PMID_24923998	24923998	10.1002/ijc.29026	2015	Comparative performance of novel self-sampling methods in detecting high-risk human papillomavirus in 30,130 women not a	UNK	UNK	nonattenders		other	unk	unk	unk	Y	DNA	direct_colposcopy	individual_RCT		5218.0		Y	referral_only			N	N	N		Auto-charted from abstract-level info; verify/complete when OA full text is available.	CORE	extractable_implementation_or_cascade_result	
PMID_25148227	25148227	10.1097/lgt.0000000000000051	2015	Feasibility of at-home self-sampling for HPV testing as an appropriate screening strategy for nonparticipants in Switzer	UNK	UNK	underscreened_general		home_mail	mail_to_home_return_mail	mail	unk	Y	UNK	cytology	observational				Y	referral_only			N	Y	N		Auto-charted from abstract-level info; verify/complete when OA full text is available.	CORE	extractable_implementation_or_cascade_result	
PMID_25284599	25284599	10.1002/ijc.29250	2015	Effectiveness of a two-stage strategy with HPV testing followed by visual inspection with acetic acid for cervical cance	UNK	UNK	other		other	unk	unk	unk	Y	UNK	cytology	individual_RCT				Y	referral_only		HPV-positive women were called back for VIA/biopsy; attendance/completion denominator not reported in the abstract.	N	N	Y		Auto-charted from abstract-level info; verify/complete when OA full text is available.	CORE	Two-stage strategy assessment with actual biopsy follow-up.	...we recruited 540 women ... HPV positive ... were called back for VIA and biopsy.
PMID_25358741	25358741	10.1007/s10903-014-0125-5	2015	Feasibility of Cervical Cancer Screening Utilizing Self-sample Human Papillomavirus Testing Among Mexican Immigrant Wome	UNK	UNK	migrant_minority		primary_care	clinic_pickup_return_clinic	in_person	unk	Y	UNK	cytology	other				Y	referral_only			N	Y	N		Auto-charted from abstract-level info; verify/complete when OA full text is available.	CORE	extractable_implementation_or_cascade_result	
PMID_25403717	25403717	10.1177/0969141314558785	2015	A randomized controlled trial in non-responders from Newcastle upon Tyne invited to return a self-sample for Human Papil	UNK	UNK	nonattenders		home_mail	mail_to_home_return_mail	mail	unk	Y	DNA	cytology	individual_RCT	6000.0	411.0	6.8	Y	completion_reported	59.4	The reported 19/32 follow-up completion refers to attendance for cytology triage after an hrHPV-positive self-sample.	N	N	N		Auto-charted from abstract-level info; verify/complete when OA full text is available.	CORE	extractable_implementation_or_cascade_result	
